{
  "schema_version": 1,
  "run_id": "grounded_answer_smoke_20260908_v1",
  "executed_at": "2026-09-08T20:18:37+09:00",
  "environment": "local",
  "question_set_version": "mvp2_grounded_answer_smoke_v1",
  "summary": {
    "total": 2,
    "passed": 2,
    "ambiguous": 0,
    "failed": 0,
    "not_run": 0
  },
  "results": [
    {
      "scenario_id": "grounded_answer_001",
      "case_id": "chat_knowledge_001",
      "category": "baseball_knowledge",
      "sanitized_input": "보크가 뭐야?",
      "expected_tool": "search_baseball_knowledge",
      "observed_tool": "search_baseball_knowledge",
      "result": "passed",
      "failure_labels": [],
      "observed_behavior": "검색된 공식 규칙 근거를 사용해 보크의 의미와 주자 진루 결과를 최종 자연어 답변에서 직접 설명하고, 자료 기준일과 needs_review 상태를 표시했다.",
      "notes": "routing LLM, Tool, answer generation LLM을 모두 통과했다. 완료까지 약 37초가 걸려 후속 latency 측정이 필요하다."
    },
    {
      "scenario_id": "grounded_answer_002",
      "case_id": "chat_guide_001",
      "category": "stadium_guide",
      "sanitized_input": "고척돔 음식물 반입 가능해?",
      "expected_tool": "search_stadium_guide",
      "observed_tool": "search_stadium_guide",
      "result": "passed",
      "failure_labels": [],
      "observed_behavior": "검색 근거가 음료 용기 제한만 포함한다는 점을 구분해 일반 음식물 반입 여부는 확답할 수 없다고 답하고, 확인된 제한·기준일·공식 출처 확인 필요성을 안내했다.",
      "notes": "근거 부족 상태에서 내용을 생성하지 않는 동작을 확인했다. 완료까지 약 42초가 걸려 후속 latency 측정이 필요하다."
    }
  ]
}
